{
  "run_id": "run-002-intermediate-gym-strength-injury",
  "phase": "architecture_review",
  "produced_by": "quality-reviewer",
  "version": 1,
  "status": "validated",
  "created_at": "2026-02-03T09:12:25+00:00",
  "payload": {
    "phase_reviewed": "architecture",
    "phase_reviewed_version": 1,
    "result": "pass",
    "checks": [
      {"name": "schema_validation", "passed": true},
      {"name": "target_minutes_fits_session_length", "passed": true, "detail": "55 min target vs. 60 min confirmed leaves a short buffer, appropriate for a gym session with equipment transitions."},
      {"name": "split_appropriate_for_experience_level", "passed": true, "detail": "Upper/lower x2 weekly matches NSCA guidance cited in research.json for 4-day intermediate strength programs."}
    ],
    "failure_reasons": []
  }
}
