{
  "run_id": "run-003-advanced-interrupt-resume",
  "phase": "progression_plan_review",
  "produced_by": "quality-reviewer",
  "version": 1,
  "status": "validated",
  "created_at": "2026-03-18T08:08:30+00:00",
  "payload": {
    "phase_reviewed": "progression_plan",
    "phase_reviewed_version": 1,
    "result": "pass",
    "checks": [
      {"name": "schema_validation", "passed": true},
      {"name": "all_exercise_ids_exist_in_exercise_selection", "passed": true},
      {"name": "progression_actually_progresses", "passed": true, "detail": "Progression uses reps -> tempo -> reduced rest as fixed-resistance equipment limits simple load jumps -- an appropriately advanced progression model rather than naive 'add weight every week'."},
      {"name": "deload_present_for_12_week_block", "passed": true}
    ],
    "failure_reasons": []
  }
}
