{
  "run_id": "run-003-advanced-interrupt-resume",
  "phase": "research_review",
  "produced_by": "quality-reviewer",
  "version": 1,
  "status": "validated",
  "created_at": "2026-03-10T07:02:40+00:00",
  "payload": {
    "phase_reviewed": "research",
    "phase_reviewed_version": 1,
    "result": "pass",
    "checks": [
      {"name": "schema_validation", "passed": true},
      {"name": "sources_present_and_non_fabricated_format", "passed": true},
      {"name": "addresses_minimal_equipment_challenge", "passed": true, "detail": "Explicitly covers how to keep progressing hypertrophy without barbell/dumbbell loading."}
    ],
    "failure_reasons": []
  }
}
