{
  "run_id": "run-001-beginner-home-fatloss",
  "phase": "final_draft_review",
  "produced_by": "quality-reviewer",
  "version": 1,
  "status": "validated",
  "created_at": "2026-01-15T14:38:45+00:00",
  "payload": {
    "phase_reviewed": "final_draft",
    "phase_reviewed_version": 1,
    "result": "pass",
    "checks": [
      {"name": "schema_validation", "passed": true},
      {"name": "sections_order_matches_fixed_template", "passed": true},
      {"name": "faithful_to_upstream_artifacts", "passed": true, "detail": "requirements_recap, weekly_schedule, equipment_list, and safety_notes all trace directly to requirements.json / architecture.json / exercise_selection.json with no invented content."},
      {"name": "equipment_list_subset_of_requirements", "passed": true}
    ],
    "failure_reasons": []
  }
}
