{
  "run_id": "run-20261002-170239-dtxn",
  "phase": "architecture_review",
  "produced_by": "quality-reviewer",
  "version": 1,
  "status": "validated",
  "created_at": "2026-10-02T17:15:00+00:00",
  "payload": {
    "phase_reviewed": "architecture",
    "phase_reviewed_version": 1,
    "result": "pass",
    "checks": [
      {"name": "mechanical_validation", "passed": true, "detail": "validate_artifact.py returned pass with no errors."},
      {"name": "session_count_matches_days_per_week", "passed": true, "detail": "3 sessions for 3 days/week (Tue/Thu/Sat), non-consecutive."},
      {"name": "target_minutes_fit_session_length", "passed": true, "detail": "35 min each, within confirmed 40 min with buffer for warm-up/transitions."},
      {"name": "split_fits_experience_level", "passed": true, "detail": "Full-body 3x/week with linear progression and a deload is appropriate for a beginner."},
      {"name": "knee_contraindication_respected", "passed": true, "detail": "Squat pattern appears on day1 and day3, but the artifact states shallow-to-moderate knee flexion only, with no deep squat/lunge work. exercise-selector must enforce knee_deep_flexion exclusion."},
      {"name": "goal_alignment_fat_loss", "passed": true, "detail": "Carry, circuit finish and shorter rest used for energy expenditure; equipment-agnostic, compatible with dumbbell+bodyweight."},
      {"name": "periodization_progresses", "passed": true, "detail": "Weeks 1-2 intro, 3-6 volume then load, week 7 peak, week 8 deload within 8 weeks total."}
    ],
    "failure_reasons": []
  }
}
