{
 "run_id": "run-20261002-170239-dtxn",
 "phase": "final_draft_review",
 "produced_by": "quality-reviewer",
 "version": 1,
 "status": "draft",
 "created_at": "2026-10-02T17:30:00+00:00",
 "payload": {
  "phase_reviewed": "final_draft",
  "phase_reviewed_version": 1,
  "result": "pass",
  "checks": [
   {"name": "mechanical_validation", "passed": true, "detail": "validate_artifact.py returned pass with no errors."},
   {"name": "section_structure_and_order", "passed": true, "detail": "sections_order and the preview headings are the fixed 8 sections in order (Summary through Sources), plus a title and a trailing caveats line."},
   {"name": "sessions_match_exercise_selection_v2", "passed": true, "detail": "final_draft.sessions is identical to exercise_selection v2; preview tables match every exercise, sets, reps and rest value for days 1-3."},
   {"name": "schedule_and_progression_match_v3", "passed": true, "detail": "Tue/Thu/Sat, 35 min targets match architecture. Week 1 is 2 sets per exercise, weeks 2-7 are the prescribed sets, week 8 is the deload with 4 RIR and 2 sets (deload_weeks=[8]). RIR per week matches progression_plan v3."},
   {"name": "knee_safety_preserved", "passed": true, "detail": "Only shallow bodyweight squats, RDL and glute bridges. No lunges or loaded squats. The knee precaution, depth limit and clinician note are present."},
   {"name": "session_time_honesty", "passed": true, "detail": "My rough estimate of work plus rest is about 27-28 min per session before warm-up. This is consistent with the 35 min targets and the 40 min limit. The summary says 'about 35-40 minutes', which is acceptable."},
   {"name": "no_invented_content", "passed": true, "detail": "All exercises come from exercise_selection (MCP-sourced). The substitution notes (single-arm row, reverse lunge excluded) are consistent with upstream. Sources match the research citations."},
   {"name": "caveats_present", "passed": true, "detail": "source_caveats and the preview end note say the sources are secondary and that nutrition is out of scope. A not-medical-advice note is included."}
  ],
  "failure_reasons": []
 }
}
