{
  "run_id": "run-002-intermediate-gym-strength-injury",
  "phase": "final_draft_review",
  "produced_by": "quality-reviewer",
  "version": 1,
  "status": "validated",
  "created_at": "2026-02-03T09:18:40+00:00",
  "payload": {
    "phase_reviewed": "final_draft",
    "phase_reviewed_version": 1,
    "result": "pass",
    "checks": [
      {"name": "schema_validation", "passed": true},
      {"name": "sections_order_matches_fixed_template", "passed": true},
      {"name": "faithful_to_upstream_artifacts", "passed": true},
      {"name": "shoulder_substitution_surfaced_in_safety_notes", "passed": true, "detail": "The landmine-press substitution and its reason are explicitly called out for the user, not buried only in artifact JSON."}
    ],
    "failure_reasons": []
  }
}
