{
  "run_id": "run-002-intermediate-gym-strength-injury",
  "phase": "research_review",
  "produced_by": "quality-reviewer",
  "version": 1,
  "status": "validated",
  "created_at": "2026-02-03T09:12:20+00:00",
  "payload": {
    "phase_reviewed": "research",
    "phase_reviewed_version": 1,
    "result": "pass",
    "checks": [
      {"name": "schema_validation", "passed": true},
      {"name": "sources_present_and_non_fabricated_format", "passed": true},
      {"name": "addresses_confirmed_constraint", "passed": true, "detail": "A finding specifically covers shoulder-impingement pressing alternatives, matching the confirmed constraint."}
    ],
    "failure_reasons": []
  }
}
