{
  "run_id": "run-003-advanced-interrupt-resume",
  "phase": "final_draft_review",
  "produced_by": "quality-reviewer",
  "version": 1,
  "status": "validated",
  "created_at": "2026-03-18T08:10:25+00:00",
  "payload": {
    "phase_reviewed": "final_draft",
    "phase_reviewed_version": 1,
    "result": "pass",
    "checks": [
      {"name": "schema_validation", "passed": true},
      {"name": "sections_order_matches_fixed_template", "passed": true},
      {"name": "faithful_to_upstream_artifacts", "passed": true}
    ],
    "failure_reasons": []
  }
}
