{
  "run_id": "run-001-beginner-home-fatloss",
  "phase": "exercise_selection_review",
  "produced_by": "quality-reviewer",
  "version": 1,
  "status": "validated",
  "created_at": "2026-01-15T14:35:10+00:00",
  "payload": {
    "phase_reviewed": "exercise_selection",
    "phase_reviewed_version": 1,
    "result": "pass",
    "checks": [
      {"name": "schema_validation", "passed": true},
      {"name": "equipment_subset_of_requirements", "passed": true, "detail": "Only bodyweight and dumbbell used, matching requirements.json."},
      {"name": "no_contraindicated_exercise", "passed": true, "detail": "No constraints were confirmed for this run, so this check is vacuously satisfied."},
      {"name": "exercise_variety", "passed": true, "detail": "db_row repeats across day1/day3 (unavoidable given equipment -- no other dumbbell/bodyweight pulling option without a bench or pull-up bar), but every other slot varies across the week."},
      {"name": "session_volume_realistic_for_target_minutes", "passed": true, "detail": "4 exercises x 2-3 sets per session fits comfortably in a 35-minute target for a beginner with 45-60s rests."}
    ],
    "failure_reasons": []
  }
}
