{
  "run_id": "run-003-advanced-interrupt-resume",
  "phase": "architecture_review",
  "produced_by": "quality-reviewer",
  "version": 1,
  "status": "validated",
  "created_at": "2026-03-10T07:02:45+00:00",
  "payload": {
    "phase_reviewed": "architecture",
    "phase_reviewed_version": 1,
    "result": "pass",
    "checks": [
      {"name": "schema_validation", "passed": true},
      {"name": "target_minutes_fits_session_length", "passed": true, "detail": "45 min target vs. 50 min confirmed leaves a short buffer."},
      {"name": "split_appropriate_for_experience_level", "passed": true, "detail": "5-day PPL+UL matches research.json's guidance for advanced trainees needing higher frequency/variety."},
      {"name": "day4_variation_distinct_from_day1_day2", "passed": true, "detail": "day_label and focus explicitly call out that Day 4 should use different push/pull variations than Days 1/2, anticipating the limited-equipment variety concern."}
    ],
    "failure_reasons": []
  }
}
